{
  "$schema": "http://json-schema.org/draft-07/schema#",
  "title": "Wenmar SDK conformance test case",
  "type": "object",
  "additionalProperties": false,
  "required": ["name", "operation", "method", "path", "mockResponses", "expect"],
  "properties": {
    "name": { "type": "string" },
    "operation": {
      "type": "string",
      "enum": ["list_customers", "show_customer", "create_customer", "update_customer", "show_vehicle", "list_vehicles", "create_vehicle", "update_vehicle", "delete_vehicle", "decode_vin", "check_duplicate", "list_work_orders", "show_work_order", "create_work_order", "update_work_order", "delete_work_order", "list_customers_paginated", "list_work_orders_paginated", "list_account", "show_location"]
    },
    "method": { "type": "string", "enum": ["GET", "POST", "PATCH", "DELETE"] },
    "path": { "type": "string" },
    "pathParams": {
      "type": "object",
      "additionalProperties": { "type": ["integer", "string"] }
    },
    "query": {
      "type": "object",
      "additionalProperties": { "type": ["integer", "string"] }
    },
    "requestBody": {
      "type": "object",
      "additionalProperties": true
    },
    "mockResponses": {
      "type": "array",
      "minItems": 1,
      "items": {
        "type": "object",
        "additionalProperties": false,
        "required": ["status"],
        "properties": {
          "status": { "type": "integer" },
          "headers": {
            "type": "object",
            "additionalProperties": { "type": "string" }
          },
          "body": {
            "type": ["object", "array", "null"]
          }
        }
      }
    },
    "expect": {
      "type": "object",
      "additionalProperties": false,
      "properties": {
        "requestCount": { "type": "integer" },
        "noError": { "type": "boolean" },
        "errorCode": { "type": "string" },
        "errorStatus": { "type": "integer" },
        "responseBody": {
          "type": "object",
          "additionalProperties": false,
          "properties": {
            "path": { "type": "string" },
            "equals": { "type": ["integer", "string", "boolean", "null"] }
          },
          "required": ["path", "equals"]
        }
      }
    }
  }
}
